Sheet: P0
B1: Custo da solução | C1: Número de turnos | D1: Tempo de procura (ms) | E1: Expansões | F1: Gerações | G1: Fator médio de ramificação
A2: largura | B2: 1800 | C2: 5 | D2: 0 | E2: 61 | F2: 170 | G2: of:==ROUND(([.F2]/[.E2]); 2) -> 2.79
A3: profundidade | B3: 1800 | C3: 5 | D3: 0 | E3: 5 | F3: 15 | G3: of:==ROUND(([.F3]/[.E3]); 2) -> 3
A4: profundidade-iterativa | B4: 1800 | C4: 5 | D4: 0 | E4: 168 | F4: 575 | G4: of:==ROUND(([.F4]/[.E4]); 2) -> 3.42
A5: ida* | B5: 1080 | C5: 3 | D5: 0 | E5: 5 | F5: 11 | G5: of:==ROUND(([.F5]/[.E5]); 2) -> 2.2
A6: a*.melhor.heuristica | B6: 1080 | C6: 3 | D6: 0 | E6: 5 | F6: 21 | G6: of:==ROUND(([.F6]/[.E6]); 2) -> 4.2
A7: a*.melhor.heuristica.alternativa | B7: 1080 | C7: 3 | D7: 0 | E7: 12 | F7: 30 | G7: of:==ROUND(([.F7]/[.E7]); 2) -> 2.5
A8: sondagem.iterativa | B8: 1080 | C8: 3 | D8: 4384 | E8: 3010422 | F8: 9062104 | G8: of:==ROUND(([.F8]/[.E8]); 2) -> 3.01
A9: ILDS | B9: 1080 | C9: 3 | D9: 5000 | E9: 92733126 | F9: 216 | G9: of:==ROUND(([.F9]/[.E9]); 2) -> 0
A10: abordagem.alternativa | B10: 1080 | C10: 3 | D10: 0 | E10: 6 | F10: 11 | G10: of:==ROUND(([.F10]/[.E10]); 2) -> 1.83
A11: melhor.abordagem | B11: 1080 | C11: 3 | D11: 0 | E11: 5 | F11: 21 | G11: of:==ROUND(([.F11]/[.E11]); 2) -> 4.2

Sheet: P1
B1: Custo da solução | C1: Número de turnos | D1: Tempo de procura (ms) | E1: Expansões | F1: Gerações | G1: Fator médio de ramificação
A2: largura
A3: profundidade | B3: 29520 | C3: 82 | D3: 8 | E3: 82 | F3: 3403 | G3: of:==ROUND(([.F3]/[.E3]); 2) -> 41.5
A4: profundidade-iterativa
A5: ida* | B5: 9808 | C5: 25 | D5: 600 | E5: 82 | F5: 1381 | G5: of:==ROUND(([.F5]/[.E5]); 2) -> 16.84
A6: a*.melhor.heuristica | B6: 9740 | C6: 25 | D6: 1328 | E6: 82 | F6: 3334 | G6: of:==ROUND(([.F6]/[.E6]); 2) -> 40.66
A7: a*.melhor.heuristica.alternativa | B7: 12778 | C7: 32 | D7: 32 | E7: 237 | F7: 1309 | G7: of:==ROUND(([.F7]/[.E7]); 2) -> 5.52
A8: sondagem.iterativa | B8: 15005 | C8: 39 | D8: 4032 | E8: 35607 | F8: 2902784 | G8: of:==ROUND(([.F8]/[.E8]); 2) -> 81.52
A9: ILDS | B9: 9661 | C9: 25 | D9: 5228 | E9: 2440 | F9: 24370 | G9: of:==ROUND(([.F9]/[.E9]); 2) -> 9.99
A10: abordagem.alternativa | B10: 9808 | C10: 25 | D10: 576 | E10: 83 | F10: 1381 | G10: of:==ROUND(([.F10]/[.E10]); 2) -> 16.64
A11: melhor.abordagem | B11: 9740 | C11: 25 | D11: 1300 | E11: 82 | F11: 3334 | G11: of:==ROUND(([.F11]/[.E11]); 2) -> 40.66

Sheet: P2
B1: Custo da solução | C1: Número de turnos | D1: Tempo de procura (ms) | E1: Expansões | F1: Gerações | G1: Fator médio de ramificação
A2: largura
A3: profundidade | B3: 58320 | C3: 162 | D3: 84 | E3: 162 | F3: 13203 | G3: of:==ROUND(([.F3]/[.E3]); 2) -> 81.5
A4: profundidade-iterativa
A5: ida* | B5: 22720 | C5: 56 | D5: 4968 | E5: 162 | F5: 4324 | G5: of:==ROUND(([.F5]/[.E5]); 2) -> 26.69
A6: a*.melhor.heuristica | B6: 22478 | C6: 55 | D6: 32692 | E6: 162 | F6: 11559 | G6: of:==ROUND(([.F6]/[.E6]); 2) -> 71.35
A7: a*.melhor.heuristica.alternativa | B7: 27987 | C7: 69 | D7: 200 | E7: 536 | F7: 3637 | G7: of:==ROUND(([.F7]/[.E7]); 2) -> 6.79
A8: sondagem.iterativa | B8: 30853 | C8: 77 | D8: 4280 | E8: 11410 | F8: 1921445 | G8: of:==ROUND(([.F8]/[.E8]); 2) -> 168.4
A9: ILDS | B9: 22573 | C9: 55 | D9: 5820 | E9: 163 | F9: 5273 | G9: of:==ROUND(([.F9]/[.E9]); 2) -> 32.35
A10: abordagem.alternativa | B10: 22720 | C10: 56 | D10: 4956 | E10: 163 | F10: 4324 | G10: of:==ROUND(([.F10]/[.E10]); 2) -> 26.53
A11: melhor.abordagem | B11: 22478 | C11: 55 | D11: 31736 | E11: 162 | F11: 11559 | G11: of:==ROUND(([.F11]/[.E11]); 2) -> 71.35

Sheet: P3
B1: Custo da solução | C1: Número de turnos | D1: Tempo de procura (ms) | E1: Expansões | F1: Gerações | G1: Fator médio de ramificação
A2: largura
A3: profundidade | B3: 87840 | C3: 244 | D3: 340 | E3: 244 | F3: 29890 | G3: of:==ROUND(([.F3]/[.E3]); 2) -> 122.5
A4: profundidade-iterativa
A5: ida* | B5: 35742 | C5: 86 | D5: 21440 | E5: 244 | F5: 11941 | G5: of:==ROUND(([.F5]/[.E5]); 2) -> 48.94
A6: a*.melhor.heuristica | B6: 35012 | C6: 85 | D6: 185028 | E6: 244 | F6: 35410 | G6: of:==ROUND(([.F6]/[.E6]); 2) -> 145.12
A7: a*.melhor.heuristica.alternativa | B7: 40498 | C7: 96 | D7: 600 | E7: 250 | F7: 5329 | G7: of:==ROUND(([.F7]/[.E7]); 2) -> 21.32
A8: sondagem.iterativa | B8: 49290 | C8: 125 | D8: 4856 | E8: 6125 | F8: 1498301 | G8: of:==ROUND(([.F8]/[.E8]); 2) -> 244.62
A9: ILDS | B9: 35141 | C9: 85 | D9: 22932 | E9: 245 | F9: 11617 | G9: of:==ROUND(([.F9]/[.E9]); 2) -> 47.42
A10: abordagem.alternativa | B10: 35742 | C10: 86 | D10: 21140 | E10: 245 | F10: 11941 | G10: of:==ROUND(([.F10]/[.E10]); 2) -> 48.74
A11: melhor.abordagem | B11: 35141 | C11: 85 | D11: 22716 | E11: 245 | F11: 11617 | G11: of:==ROUND(([.F11]/[.E11]); 2) -> 47.42

Sheet: P4
B1: Custo da solução | C1: Número de turnos | D1: Tempo de procura (ms) | E1: Expansões | F1: Gerações | G1: Fator médio de ramificação
A2: largura
A3: profundidade
A4: profundidade-iterativa
A5: ida*
A6: a*.melhor.heuristica
A7: a*.melhor.heuristica.alternativa | B7: 77607 | C7: 188 | D7: 4136 | E7: 487 | F7: 18941 | G7: of:==ROUND(([.F7]/[.E7]); 2) -> 38.89
A8: sondagem.iterativa | B8: 95801 | C8: 239 | D8: 5336 | E8: 1892 | F8: 925326 | G8: of:==ROUND(([.F8]/[.E8]); 2) -> 489.07
A9: ILDS
A10: abordagem.alternativa
A11: melhor.abordagem | B11: 79247 | C11: 195 | D11: 8024 | E11: 945 | F11: 23057 | G11: of:==ROUND(([.F11]/[.E11]); 2) -> 24.4

Sheet: P5
B1: Custo da solução | C1: Número de turnos | D1: Tempo de procura (ms) | E1: Expansões | F1: Gerações | G1: Fator médio de ramificação
A2: largura
A3: profundidade
A4: profundidade-iterativa
A5: ida*
A6: a*.melhor.heuristica
A7: a*.melhor.heuristica.alternativa
A8: sondagem.iterativa | B8: 136033 | C8: 334 | D8: 4696 | E8: 694 | F8: 537033 | G8: of:==ROUND(([.F8]/[.E8]); 2) -> 773.82
A9: ILDS
A10: abordagem.alternativa
A11: melhor.abordagem | B11: 113086 | C11: 269 | D11: 12792 | E11: 694 | F11: 16254 | G11: of:==ROUND(([.F11]/[.E11]); 2) -> 23.42